property_ID,Listing_ID,price,baths_half,baths_full,baths,beds,size_in_sqft,lot_size_in_sqft,prop_type,prop_sub_type,city,Line,postal_code,lat,lon,neighborhood_name,Listing_Url,thumbnail,LatLong,Num_bars,Mean_Rating_bars,Mean_PriceLevel_bars,Top_5_Rated_bars,Num_restaurants,Mean_Rating_restaurants,Mean_PriceLevel_restaurants,Top_5_Rated_restaurants
M5313054191,2920960562,529900,,1.0,1,1.0,782.0,,condo,condos,Arlington,1021 N Garfield St Apt 211,22201,38.88537120000001,-77.0933837,North Arlington,https://www.realtor.com/realestateandhomes-detail/1021-N-Garfield-St-Apt-211_Arlington_VA_22201_M53130-54191,https://ap.rdcpix.com/6caa48504e599bbc8584c168a94b0ec3l-m1902306599x.jpg,"38.88537120000001,-77.0933837",56.0,4.338888888888888,1.9,"Ms. Peacock's Champagne Lounge; Arlington Pub; East West Coffee Wine; O'Sullivans Sundays-Free Comedy Open Mic Arlington,VA; Screwtop Wine Bar",90.0,4.157777777777778,1.6785714285714286,Philippine Oriental Market & Deli; Screwtop Wine Bar; The Italian Store; Troy's Italian Kitchen; Ambar Clarendon
M6846872815,2920931741,300000,,1.0,1,1.0,630.0,,condo,condos,Arlington,2007 Key Blvd Unit 12592,22201,38.89459788,-77.08407204,Colonial Village,https://www.realtor.com/realestateandhomes-detail/2007-Key-Blvd-12592_Arlington_VA_22201_M68468-72815,https://ap.rdcpix.com/0b8de57067f4954581280ceae581aefcl-m919555759x.jpg,"38.89459788,-77.08407204",55.0,4.324074074074074,1.9024390243902438,"Ms. Peacock's Champagne Lounge; Arlington Pub; East West Coffee Wine; O'Sullivans Sundays-Free Comedy Open Mic Arlington,VA; Screwtop Wine Bar",69.0,4.197101449275362,1.75,Screwtop Wine Bar; The Italian Store; Ambar Clarendon; Bakeshop; Earl's Sandwiches
M5095234757,2920931491,372500,,1.0,1,2.0,679.0,,condo,condos,Arlington,2104 N Scott St Apt 32,22209,38.89868,-77.08211,North Highland,https://www.realtor.com/realestateandhomes-detail/2104-N-Scott-St-Apt-32_Arlington_VA_22209_M50952-34757,https://ap.rdcpix.com/5f0e75772531802767fd8c9c87dde487l-m2463139550x.jpg,"38.89868,-77.08211",37.0,4.28888888888889,2.0,Arlington Pub; TTT Rooftop; 1789; Galaxy Hut; Verre Wine Bar,45.0,4.191111111111112,1.8181818181818181,The Italian Store; 1789; Ambar Clarendon; Earl's Sandwiches; Genji Express
M6054997584,2920931740,649900,1.0,2.0,3,3.0,1400.0,,condo,townhomes,Arlington,1731 S Hayes St Unit 2,22202,38.859284,-77.058402,Pentagon City,https://www.realtor.com/realestateandhomes-detail/1731-S-Hayes-St-2_Arlington_VA_22202_M60549-97584,https://ap.rdcpix.com/f3e61b1645434f9f0d03f6a0a90754d9l-m1193092670x.jpg,"38.859284,-77.058402",34.0,3.9575757575757584,1.9130434782608696,QDOBA Mexican Eats; Lobbibar; Freddie's Beach Bar & Restaurant; QDOBA Mexican Eats; Basin Barroom,92.0,3.967032967032967,1.6883116883116882,Fresh Chop Chop; Sushi Garden; The Athena Pallas Restaurant; Bozzelli's; Chick-fil-A
M5176676738,2920931692,455900,,2.0,2,2.0,1135.0,,condo,condos,Arlington,4129 S Four Mile Run Dr Unit 303,22204,38.84956,-77.09746899999999,Douglas Park,https://www.realtor.com/realestateandhomes-detail/4129-S-Four-Mile-Run-Dr-Unit-303_Arlington_VA_22204_M51766-76738,https://ap.rdcpix.com/dec895ceaba118d3f91576be7e2de9efl-m3014592230x.jpg,"38.84956,-77.09746899999999",13.0,4.353846153846154,2.0,Ali's Bar; Tobacco King & Vape King; Carlyle; Busboys And Poets; Cheesetique Shirlington,61.0,4.008196721311476,1.48,Pho Harmony & Grill; Best Buns Bread Company; Blanca's Snow Cones - Shaved Ice; Carlyle; Aroma Restaurant
M5081335630,2920926841,824888,1.0,2.0,3,3.0,1214.0,10007.0,single_family,,Arlington,6007 Williamsburg Blvd,22207,38.904538,-77.15248000000001,Williamsburg,https://www.realtor.com/realestateandhomes-detail/6007-Williamsburg-Blvd_Arlington_VA_22207_M50813-35630,https://ap.rdcpix.com/b1273af75d0f141532f518ebecae660fl-m3611843775x.jpg,"38.904538,-77.15248000000001",1.0,4.0,1.0,Taqueria El Poblano,19.0,4.383333333333334,1.5,Maya Bistro; Chill Zone Cafe Arlington; Sushi-Zen; pie-tanza; Deli Italiano Gourmet Pizza and Subs
M9942138914,2920925743,315000,,1.0,1,1.0,440.0,,condo,condos,Arlington,989 S Buchanan St Unit 323,22204,38.857067,-77.108583,Barcroft,https://www.realtor.com/realestateandhomes-detail/989-S-Buchanan-St-323_Arlington_VA_22204_M99421-38914,https://ap.rdcpix.com/68fdf4d6f9be0b0f6dc80d19e7a0dc29l-m144106719x.jpg,"38.857067,-77.108583",6.0,4.233333333333333,2.0,"Tobacco King Of Vape, CBD, Kratom; Crystal Thai Restaurant; LongHorn Steakhouse; Olive Garden Italian Restaurant; Outback Steakhouse",37.0,3.975675675675676,1.3823529411764706,Rawal Kabob; Blanca's Snow Cones - Shaved Ice; Pho Golden Star; The Broiler; Crystal Thai Restaurant
M6848661581,2920922465,315000,,1.0,1,1.0,550.0,,condo,condos,Arlington,1811 Key Blvd Unit 10530,22201,38.89512,-77.08261,Colonial Village,https://www.realtor.com/realestateandhomes-detail/1811-Key-Blvd-10530_Arlington_VA_22201_M68486-61581,https://ap.rdcpix.com/a256225ff1e087a1a3ea9302ab131a62l-m1628820026x.jpg,"38.89512,-77.08261",53.0,4.328846153846154,1.951219512195122,"Ms. Peacock's Champagne Lounge; Arlington Pub; East West Coffee Wine; O'Sullivans Sundays-Free Comedy Open Mic Arlington,VA; Screwtop Wine Bar",63.0,4.2095238095238106,1.8064516129032258,Screwtop Wine Bar; The Italian Store; 1789; Ambar Clarendon; Bakeshop
M5181346047,2920919376,1898648,1.0,5.0,6,6.0,5584.0,7500.0,single_family,,Arlington,1908 N Underwood St,22205,38.884843,-77.158571,East Falls Church,https://www.realtor.com/realestateandhomes-detail/1908-N-Underwood-St_Arlington_VA_22205_M51813-46047,https://ap.rdcpix.com/b1ddd3aa648e0fc466b82d8dc4653587l-m4022810802x.jpg,"38.884843,-77.158571",15.0,4.4,1.9,"The Casual Pint of Falls Church; Trade Roots, Fair Trade Gift Shop, Coffee House, & Wine Bar; Cafe H2O; Clare & Don's Beach Shack; Ireland's Four Provinces",63.0,4.1508196721311466,1.6041666666666667,Badd Pizza; Mediterranean Chicken; The Italian Store; YUME SUSHI; Banh Cuon Saigon
M9282632346,2920919216,9500,,,0,0.0,162.0,,single_family,,Arlington,1121 Arlington Blvd Unit MP437,22209,38.89332967,-77.06984181,Radnor - Fort Myer Heights,https://www.realtor.com/realestateandhomes-detail/1121-Arlington-Blvd-MP437_Arlington_VA_22209_M92826-32346,https://ap.rdcpix.com/c2cba6807f1c6de08852c08ed833c08al-m2106312365x.jpg,"38.89332967,-77.06984181",50.0,4.244897959183674,2.2325581395348837,Rosewood Washington DC; 1789; Blues Alley Club; Chez Billy Sud; City Tavern Club,46.0,4.219565217391305,2.0444444444444443,1789; Filomena Ristorante; Martin's Tavern; Mele Bistro; Cafe Milano
M6013206719,2920919097,650000,,1.0,1,1.0,612.0,5000.0,single_family,,Arlington,2001 N George Mason Dr,22207,38.893116,-77.13045600000001,High View Park,https://www.realtor.com/realestateandhomes-detail/2001-N-George-Mason-Dr_Arlington_VA_22207_M60132-06719,,"38.893116,-77.13045600000001",11.0,4.39090909090909,1.625,"Todd Alley; Trade Roots, Fair Trade Gift Shop, Coffee House, & Wine Bar; Westover Market; Cowboy Cafe; Lebanese Taverna",53.0,4.128846153846154,1.4285714285714286,Cafe Colline; Maya Bistro; Todd Alley; Arlington Kabob; Chill Zone Cafe Arlington
M5334140569,2920918806,384000,,1.0,1,1.0,634.0,,condo,condos,Arlington,1001 N Randolph St Apt 417,22201,38.88309,-77.1092,Ballston - Virginia Square,https://www.realtor.com/realestateandhomes-detail/1001-N-Randolph-St-Apt-417_Arlington_VA_22201_M53341-40569,https://ap.rdcpix.com/63188db13f274bdeeee241fa6fcc9d72l-m1664768285x.jpg,"38.88309,-77.1092",51.0,4.291666666666666,1.9705882352941178,"Ballston Service Station; Ms. Peacock's Champagne Lounge; East West Coffee Wine; O'Sullivans Sundays-Free Comedy Open Mic Arlington,VA; Screwtop Wine Bar",91.0,4.104444444444445,1.7058823529411764,Philippine Oriental Market & Deli; Screwtop Wine Bar; Ambar Clarendon; Bakeshop; Northside Social Coffee & Wine
M5996694879,2920917422,1150000,,2.0,2,1.0,1645.0,,condo,condos,Arlington,1881 N Nash St Unit 1204,22209,38.89783,-77.07336,North Rosslyn,https://www.realtor.com/realestateandhomes-detail/1881-N-Nash-St-Unit-1204_Arlington_VA_22209_M59966-94879,https://ap.rdcpix.com/daa3d2fd704dd36bbfd17fa95874266fl-m858343040x.jpg,"38.89783,-77.07336",54.0,4.232075471698113,2.260869565217391,Rosewood Washington DC; 1789; Blues Alley Club; Chez Billy Sud; City Tavern Club,52.0,4.19423076923077,2.04,1789; Filomena Ristorante; Martin's Tavern; BOURBON STEAK; Mele Bistro
M5114759665,2920911576,360000,,2.0,2,2.0,923.0,,condo,condos,Arlington,5544 Lee Hwy Unit 41E,22207,38.895352,-77.139983,Leeway Overlee,https://www.realtor.com/realestateandhomes-detail/5544-Lee-Hwy-E41_Arlington_VA_22207_M51147-59665,https://ap.rdcpix.com/3bbd31453093ef3aee73fd00f55adc6fl-m3066973644x.jpg,"38.895352,-77.139983",10.0,4.389999999999999,1.4285714285714286,"Todd Alley; Trade Roots, Fair Trade Gift Shop, Coffee House, & Wine Bar; Westover Market; Cowboy Cafe; Lebanese Taverna",49.0,4.135416666666667,1.368421052631579,Maya Bistro; Todd Alley; Arlington Kabob; Chill Zone Cafe Arlington; The Italian Store
M6404147978,2920905844,1600000,,4.0,4,4.0,3700.0,12677.0,single_family,,Arlington,3815 30th Rd N,22207,38.914965,-77.113989,Bellevue Forest,https://www.realtor.com/realestateandhomes-detail/3815-30th-Rd-N_Arlington_VA_22207_M64041-47978,https://ap.rdcpix.com/b91444b1d008433cab37f0732b242b94l-m1132499906x.jpg,"38.914965,-77.113989",1.0,4.6,3.0,BlackSalt,14.0,4.464285714285714,2.142857142857143,Bistro Aracosia; Go Popolo SPK; Lupo Verde Osteria Palisades; BlackSalt; Et Voila !
M5877686230,2920904033,682500,,2.0,2,2.0,1516.0,,condo,condos,Arlington,1300 Crystal Dr Apt 1310S,22202,38.861938,-77.04946899999999,Crystal City,https://www.realtor.com/realestateandhomes-detail/1300-Crystal-Dr-Apt-1310S_Arlington_VA_22202_M58776-86230,https://ap.rdcpix.com/4c0a34da2087487250cc5c3738979b7fl-m303688420x.jpg,"38.861938,-77.04946899999999",38.0,4.029729729729731,1.8076923076923077,Island Time Bar & Grill; QDOBA Mexican Eats; Delta Sky Club; Lobbibar; Freddie's Beach Bar & Restaurant,91.0,3.9866666666666664,1.6973684210526316,Fresh Chop Chop; Sushi Garden; The Athena Pallas Restaurant; Bozzelli's; Chick-fil-A
M5875026530,2920894838,330000,,1.0,1,1.0,900.0,,condo,condos,Arlington,1300 Army Navy Dr Apt 429,22202,38.863471000000004,-77.067261,Pentagon City,https://www.realtor.com/realestateandhomes-detail/1300-Army-Navy-Dr-Apt-429_Arlington_VA_22202_M58750-26530,https://ap.rdcpix.com/cd6632d959d43e83fa2787b19d151066l-m712198605x.jpg,"38.863471000000004,-77.067261",22.0,4.219047619047619,1.7777777777777777,QDOBA Mexican Eats; The Celtic House Irish Pub & Restaurant; Freddie's Beach Bar & Restaurant; QDOBA Mexican Eats; Basin Barroom,72.0,3.9915492957746466,1.59375,Burrito Bros; Sushi Garden; The Athena Pallas Restaurant; The Celtic House Irish Pub & Restaurant; Dama Pastry & Cafe
M5993729929,2920894842,1199000,1.0,4.0,5,5.0,3820.0,5418.0,single_family,,Arlington,2415 2nd St S,22204,38.871556,-77.085246,Penrose,https://www.realtor.com/realestateandhomes-detail/2415-2nd-St-S_Arlington_VA_22204_M59937-29929,https://ap.rdcpix.com/41172f6bd599dbfb05d90747ca375760l-m4209088703x.jpg,"38.871556,-77.085246",10.0,4.17,1.8571428571428572,Ms. Peacock's Champagne Lounge; The Celtic House Irish Pub & Restaurant; Caspi Restaurant and Lounge; L.A. Bar & Grill; The Board Room VA,59.0,4.035593220338982,1.4423076923076923,Pho Harmony & Grill; Tortas Y Tacos La Chiquita; Troy's Italian Kitchen; Burrito Bros; The Celtic House Irish Pub & Restaurant
M6039431793,2920891850,695000,2.0,2.0,4,3.0,2352.0,,condo,townhomes,Arlington,2434 S Walter Reed Dr Unit 6,22206,38.845807,-77.09980300000001,South Arlington,https://www.realtor.com/realestateandhomes-detail/2434-S-Walter-Reed-Dr_Arlington_VA_22206_M60394-31793,https://ap.rdcpix.com/ebec628b1bec3f6d9760527dbd10e415l-m1409370021x.jpg,"38.845807,-77.09980300000001",12.0,4.391666666666667,2.0,Ali's Bar; Tobacco King & Vape King; Carlyle; Busboys And Poets; Cheesetique Shirlington,51.0,4.090196078431372,1.5609756097560976,Rawal Kabob; Best Buns Bread Company; Blanca's Snow Cones - Shaved Ice; Carlyle; Aroma Restaurant
M5389364172,2920891658,269900,,1.0,1,1.0,684.0,,condo,condos,Arlington,1300 S Arlington Ridge Rd Apt 609,22202,38.861609,-77.067356,Pentagon City,https://www.realtor.com/realestateandhomes-detail/1300-S-Arlington-Ridge-Rd-Apt-609_Arlington_VA_22202_M53893-64172,https://ap.rdcpix.com/b49d5261a9457712570a241d7b41c55cl-m1734193171x.jpg,"38.861609,-77.067356",24.0,4.213043478260871,1.7894736842105263,QDOBA Mexican Eats; The Celtic House Irish Pub & Restaurant; Freddie's Beach Bar & Restaurant; QDOBA Mexican Eats; Basin Barroom,75.0,4.013513513513513,1.6515151515151516,Burrito Bros; Sushi Garden; The Athena Pallas Restaurant; The Celtic House Irish Pub & Restaurant; Dama Pastry & Cafe
M6621375526,2920889561,354900,,1.0,1,2.0,800.0,,condo,condos,Arlington,4623 28th Rd S Apt D,22206,38.843561,-77.099585,South Arlington,https://www.realtor.com/realestateandhomes-detail/4623-28th-Rd-S-Apt-D_Arlington_VA_22206_M66213-75526,https://ap.rdcpix.com/b5d912254bbeb831eabd9a3853e51fdcl-m2742088426x.jpg,"38.843561,-77.099585",11.0,4.363636363636363,2.0,Ali's Bar; Carlyle; Busboys And Poets; Cheesetique Shirlington; Samuel Beckett's Irish Gastro Pub,41.0,4.107317073170733,1.5454545454545454,Best Buns Bread Company; Carlyle; Aroma Restaurant; Busboys And Poets; Cheesetique Shirlington
M5346071816,2920888546,285000,,1.0,1,1.0,856.0,,condo,condos,Arlington,4500 S Four Mile Run Dr Apt 1111,22204,38.853674,-77.106297,Columbia Forest,https://www.realtor.com/realestateandhomes-detail/4500-S-Four-Mile-Run-Dr-Apt-1111_Arlington_VA_22204_M53460-71816,https://ap.rdcpix.com/92aa78c981045996fd31fe8ca9fc91e5l-m535396158x.jpg,"38.853674,-77.106297",7.0,4.228571428571429,2.0,"Tobacco King Of Vape, CBD, Kratom; Tobacco King & Vape King; Silver Diner - Alexandria; LongHorn Steakhouse; Olive Garden Italian Restaurant",42.0,3.95,1.3333333333333333,Rawal Kabob; Blanca's Snow Cones - Shaved Ice; Pho Golden Star; Pupatella; The Broiler
M6296500121,2920882775,474900,,1.0,1,2.0,814.0,,condo,condos,Arlington,1001 N Vermont St Apt 314,22201,38.88288,-77.11437,Ballston - Virginia Square,https://www.realtor.com/realestateandhomes-detail/1001-N-Vermont-St-Apt-314_Arlington_VA_22201_M62965-00121,https://ap.rdcpix.com/75a13153e97498888e62e40951a4f9b2l-m2887923541x.jpg,"38.88288,-77.11437",28.0,4.18,2.0,"Ballston Service Station; O'Sullivans Sundays-Free Comedy Open Mic Arlington,VA; Northside Social Coffee & Wine; Spirits of '76; Utahime Asian Bistro & Bar",59.0,4.043103448275861,1.6851851851851851,La Union Restaurant; Northside Social Coffee & Wine; Pupatella; Spirits of '76; Stageplate Bistro - Arlington
M5198489207,2920870332,435000,,1.0,1,2.0,994.0,,condo,townhomes,Arlington,1303 S Barton St Unit 187,22204,38.860746,-77.08264100000001,South Arlington,https://www.realtor.com/realestateandhomes-detail/1303-S-Barton-St-Unit-187_Arlington_VA_22204_M51984-89207,https://ap.rdcpix.com/8925b98677ebb58427ec0466928840e7l-m1900740887x.jpg,"38.860746,-77.08264100000001",9.0,4.111111111111111,1.8571428571428572,Tobacco King & Vape King; The Celtic House Irish Pub & Restaurant; Caspi Restaurant and Lounge; L.A. Bar & Grill; William Jeffrey's Tavern,51.0,4.050980392156863,1.5116279069767442,Pho Harmony & Grill; Tortas Y Tacos La Chiquita; Burrito Bros; The Celtic House Irish Pub & Restaurant; Atilla's Restaurant
M6439577738,2920870388,725000,,3.0,3,5.0,1333.0,13207.0,single_family,,Arlington,6934 27th Rd N,22213,38.891844,-77.167602,East Falls Church,https://www.realtor.com/realestateandhomes-detail/6934-27th-Rd-N_Arlington_VA_22213_M64395-77738,https://ap.rdcpix.com/66f2d6bfa3f2c735ce1538c1229f9a65l-m4271675659x.jpg,"38.891844,-77.167602",5.0,4.44,2.0,Clare & Don's Beach Shack; Ireland's Four Provinces; Chasin' Tails; Dogwood Tavern; Northside Social Falls Church,44.0,4.172093023255814,1.6944444444444444,Badd Pizza; Mediterranean Chicken; YUME SUSHI; Maneki Neko Japanese Restaurant; Spacebar
M5174023183,2920870431,429900,,1.0,1,1.0,654.0,,condo,condos,Arlington,851 N Glebe Rd Apt 816,22203,38.88133,-77.11431,Ballston - Virginia Square,https://www.realtor.com/realestateandhomes-detail/851-N-Glebe-Rd-Apt-816_Arlington_VA_22203_M51740-23183,https://ap.rdcpix.com/301330698ccb28075ce73ed74803ae41l-m313820501x.jpg,"38.88133,-77.11431",28.0,4.18,2.0,"Ballston Service Station; O'Sullivans Sundays-Free Comedy Open Mic Arlington,VA; Northside Social Coffee & Wine; Spirits of '76; Utahime Asian Bistro & Bar",64.0,4.0174603174603165,1.6271186440677967,La Union Restaurant; Northside Social Coffee & Wine; Pupatella; Spirits of '76; Stageplate Bistro - Arlington
M6128352183,2920870441,1039000,2.0,3.0,5,4.0,2185.0,1091.0,condo,townhomes,Arlington,1176 N Utah St,22201,38.884951,-77.114408,Ballston - Virginia Square,https://www.realtor.com/realestateandhomes-detail/1176-N-Utah-St_Arlington_VA_22201_M61283-52183,https://ap.rdcpix.com/92b977db9c6992b54ad8ed8226fb3e95l-m1626386968x.jpg,"38.884951,-77.114408",32.0,4.175862068965517,2.0,"Ballston Service Station; O'Sullivans Sundays-Free Comedy Open Mic Arlington,VA; Northside Social Coffee & Wine; Spirits of '76; Gyu-Kaku Japanese BBQ",70.0,4.078260869565218,1.6612903225806452,Cafe Colline; Philippine Oriental Market & Deli; La Union Restaurant; Northside Social Coffee & Wine; Pupatella
M5723100283,2920870309,1999000,2.0,5.0,7,5.0,6078.0,8792.0,single_family,,Arlington,4126 26th Rd N,22207,38.905253,-77.110827,Donaldson Run,https://www.realtor.com/realestateandhomes-detail/4126-26th-Rd-N_Arlington_VA_22207_M57231-00283,https://ap.rdcpix.com/3d380968ebe43b7459dff42c59344243l-m1821312266x.jpg,"38.905253,-77.110827",2.0,4.25,1.5,Cowboy Cafe; Thirsty Bernie,24.0,3.929166666666667,1.55,Cafe Colline; Philippine Oriental Market & Deli; The Italian Store; BGR The Burger Joint; Cowboy Cafe
M6141262647,2920870410,899000,,3.0,3,5.0,2780.0,9909.0,single_family,,Arlington,6132 Lee Hwy,22205,38.89268,-77.149288,Leeway Overlee,https://www.realtor.com/realestateandhomes-detail/6132-Lee-Hwy_Arlington_VA_22205_M61412-62647,https://ap.rdcpix.com/4413790f6f67af7cff74e916afcbfc6el-m460458945x.jpg,"38.89268,-77.149288",9.0,4.422222222222222,1.5,"Todd Alley; Trade Roots, Fair Trade Gift Shop, Coffee House, & Wine Bar; Westover Market; Chasin' Tails; Lebanese Taverna",38.0,4.3567567567567576,1.5,Maya Bistro; Todd Alley; Chill Zone Cafe Arlington; The Italian Store; YUME SUSHI
M6636908761,2920833880,430000,,2.0,2,2.0,1300.0,,condo,condos,Arlington,801 S Greenbrier St Apt 413,22204,38.857746,-77.11912199999999,Arlington Mill,https://www.realtor.com/realestateandhomes-detail/801-S-Greenbrier-St-Apt-413_Arlington_VA_22204_M66369-08761,https://ap.rdcpix.com/92585512e9e516d639155c984e37d7b6l-m1507154741x.jpg,"38.857746,-77.11912199999999",9.0,4.233333333333333,1.8333333333333333,"Tobacco King Of Vape, CBD, Kratom; Laze Cafe; QDOBA Mexican Eats; Crystal Thai Restaurant; LongHorn Steakhouse",43.0,3.993023255813953,1.5,Rawal Kabob; Blanca's Snow Cones - Shaved Ice; Rabieng Thai Restaurant; Duangrat's Thai Restaurant; Pho Golden Star
M5985811755,2920801840,995000,1.0,4.0,5,4.0,2487.0,1370.0,condo,townhomes,Arlington,3504 11th St S,22204,38.859957,-77.092869,Douglas Park,https://www.realtor.com/realestateandhomes-detail/3504-11th-St-S_Arlington_VA_22204_M59858-11755,https://ap.rdcpix.com/25cfbfaeae43af8f8d473e35125623c7l-m1411185074x.jpg,"38.859957,-77.092869",8.0,4.2875000000000005,1.8333333333333333,Tobacco King & Vape King; The Celtic House Irish Pub & Restaurant; Caspi Restaurant and Lounge; L.A. Bar & Grill; William Jeffrey's Tavern,58.0,4.012068965517241,1.469387755102041,Pho Harmony & Grill; Tortas Y Tacos La Chiquita; Blanca's Snow Cones - Shaved Ice; Burrito Bros; The Celtic House Irish Pub & Restaurant
M6106902225,2920833824,1129000,,3.0,3,4.0,2301.0,9000.0,single_family,,Arlington,3311 20th St N,22207,38.894612,-77.101276,Cherrydale,https://www.realtor.com/realestateandhomes-detail/3311-20th-St-N_Arlington_VA_22207_M61069-02225,https://ap.rdcpix.com/4b6b40c056d92230c907ffaf0c9a3213l-m1193803394x.jpg,"38.894612,-77.101276",47.0,4.341304347826087,1.878787878787879,"Ms. Peacock's Champagne Lounge; Arlington Pub; East West Coffee Wine; O'Sullivans Sundays-Free Comedy Open Mic Arlington,VA; Screwtop Wine Bar",73.0,4.178082191780823,1.7205882352941178,Cafe Colline; Philippine Oriental Market & Deli; Screwtop Wine Bar; The Italian Store; Ambar Clarendon
M5475926932,2920802864,529000,,1.0,1,2.0,866.0,,condo,condos,Arlington,2101 N Monroe St Apt 214,22207,38.896481,-77.10439000000001,North Arlington,https://www.realtor.com/realestateandhomes-detail/2101-N-Monroe-St-Apt-214_Arlington_VA_22207_M54759-26932,https://ap.rdcpix.com/2488e440cb45a881ff9e663556a2647bl-m518157057x.jpg,"38.896481,-77.10439000000001",38.0,4.3432432432432435,1.9230769230769231,"Arlington Pub; East West Coffee Wine; O'Sullivans Sundays-Free Comedy Open Mic Arlington,VA; Screwtop Wine Bar; TTT Rooftop",63.0,4.152380952380953,1.7166666666666666,Cafe Colline; Philippine Oriental Market & Deli; Screwtop Wine Bar; The Italian Store; Ambar Clarendon
M6392810204,2920866991,799000,1.0,2.0,3,2.0,1248.0,915.0,condo,townhomes,Arlington,4411 7th St N,22203,38.878651,-77.113692,Bluemont,https://www.realtor.com/realestateandhomes-detail/4411-7th-St-N_Arlington_VA_22203_M63928-10204,https://ap.rdcpix.com/a5f4580f76b7dfddaad66f8f9d8ca21bl-m1060345215x.jpg,"38.878651,-77.113692",24.0,4.109523809523809,2.0,Ballston Service Station; Northside Social Coffee & Wine; Crystal Thai Restaurant; Ricky's Pub & Grill; The Bronson Bierhall,60.0,4.013559322033897,1.6363636363636365,La Union Restaurant; Northside Social Coffee & Wine; Pupatella; Stageplate Bistro - Arlington; Big Buns Damn Good Burgers
M5775997622,2920846205,899990,,4.0,4,4.0,2100.0,8169.0,single_family,,Arlington,879 N Harrison St,22205,38.878679999999996,-77.126971,Bluemont,https://www.realtor.com/realestateandhomes-detail/879-N-Harrison-St_Arlington_VA_22205_M57759-97622,https://ap.rdcpix.com/76783198bb762c163fe22ace0e8b82fcl-m636074677x.jpg,"38.878679999999996,-77.126971",24.0,4.199999999999999,1.9411764705882353,"Ballston Service Station; Trade Roots, Fair Trade Gift Shop, Coffee House, & Wine Bar; Westover Market; Crystal Thai Restaurant; Lebanese Taverna",46.0,4.133333333333334,1.6923076923076923,The Italian Store; La Union Restaurant; Lost Dog Cafe; Pupatella; Stageplate Bistro - Arlington
M5399872464,2920833860,690000,1.0,2.0,3,3.0,1568.0,,condo,condos,Arlington,720 15th St S Apt A,22202,38.859811,-77.058982,Pentagon City,https://www.realtor.com/realestateandhomes-detail/720-15th-St-S-1_Arlington_VA_22202_M53998-72464,https://ap.rdcpix.com/c493a488aadfc5f5c209b6d65bf154d4l-m4010028844x.jpg,"38.859811,-77.058982",32.0,4.0354838709677425,1.9090909090909092,QDOBA Mexican Eats; Lobbibar; Freddie's Beach Bar & Restaurant; QDOBA Mexican Eats; Basin Barroom,92.0,3.967032967032967,1.6883116883116882,Fresh Chop Chop; Sushi Garden; The Athena Pallas Restaurant; Bozzelli's; Chick-fil-A
M6808064601,2920798201,424900,,1.0,1,1.0,740.0,,condo,condos,Arlington,1020 N Stafford St Apt 403,22201,38.883109999999995,-77.11094,Ballston - Virginia Square,https://www.realtor.com/realestateandhomes-detail/1020-N-Stafford-St-Apt-403_Arlington_VA_22201_M68080-64601,https://ap.rdcpix.com/2061fc0a4dedeae75ec9910e0648d624l-m3412554092x.jpg,"38.883109999999995,-77.11094",46.0,4.269767441860465,2.0,"Ballston Service Station; Ms. Peacock's Champagne Lounge; East West Coffee Wine; O'Sullivans Sundays-Free Comedy Open Mic Arlington,VA; Screwtop Wine Bar",85.0,4.069047619047619,1.6835443037974684,Philippine Oriental Market & Deli; Screwtop Wine Bar; Northside Social Coffee & Wine; Pupatella; Spirits of '76
M6337779260,2920786863,259500,,1.0,1,2.0,884.0,,single_family,,Arlington,1111 Arlington Blvd Apt 918,22209,38.892590000000006,-77.070161,Radnor - Fort Myer Heights,https://www.realtor.com/realestateandhomes-detail/1111-Arlington-Blvd-Apt-918_Arlington_VA_22209_M63377-79260,https://ap.rdcpix.com/2b94d0164f709fd3c546fc5d913676adl-m2138241025x.jpg,"38.892590000000006,-77.070161",49.0,4.233333333333333,2.2142857142857144,Rosewood Washington DC; 1789; Blues Alley Club; Chez Billy Sud; City Tavern Club,45.0,4.171111111111112,2.0,1789; Filomena Ristorante; Mele Bistro; Clyde's of Georgetown; Degrees Bistro
M5457408634,2914557414,1345000,1.0,4.0,5,4.0,4860.0,3087.0,condo,townhomes,Arlington,2100 21st Rd N,22201,38.898084000000004,-77.084876,North Highland,https://www.realtor.com/realestateandhomes-detail/2100-21st-Rd-N_Arlington_VA_22201_M54574-08634,https://ap.rdcpix.com/bfcf15d8f71f8cce531ffd272daf0396l-m32217660x.jpg,"38.898084000000004,-77.084876",43.0,4.314285714285715,1.9411764705882353,Arlington Pub; East West Coffee Wine; Screwtop Wine Bar; TTT Rooftop; The Pinemoor,58.0,4.168965517241379,1.7894736842105263,Screwtop Wine Bar; The Italian Store; 1789; Ambar Clarendon; Bakeshop
M5543209722,2920774783,1349900,,3.0,3,3.0,3900.0,6260.0,single_family,,Arlington,4864 33rd Rd N,22207,38.910096,-77.135983,Rock Spring,https://www.realtor.com/realestateandhomes-detail/4864-33rd-Rd-N_Arlington_VA_22207_M55432-09722,https://ap.rdcpix.com/19678964bf74d779896e415f8e03c5c5l-m3286198751x.jpg,"38.910096,-77.135983",3.0,4.333333333333333,1.0,Todd Alley; Thai Thai Restaurant; Taqueria El Poblano,18.0,4.266666666666667,1.4,Todd Alley; Chill Zone Cafe Arlington; Charga Grill; Sushi-Zen; pie-tanza
